2024-07-05T07:41:29.583Z,Daniel,Praça do polar,56-60,Feminino,Pardo (a),Barra Do Ceará,,Trabalho intermitente,,,,Não utilizo,,,,,,,,,,,,,"Tenho medo de sofrer um acidente andando de bicicleta, Tenho medo de ser assaltado, Não há um lugar seguro para guardar a minha bicicleta",Concordo parcialmente,Discordo,Concordo,Concordo,Concordo parcialmente,Concordo,Discordo totalmente,Discordo totalmente,Discordo totalmente,Concordo,Concordo,Dirigindo carro,Carona de carro,Não gostaria,,,,,5 - Muito confortável,1 - Muito desconfortável,2,1 - Muito desconfortável,2,1 - Muito desconfortável,2,4,1 - Muito desconfortável,2,5 - Muito confortável,4 - Concordo,Não,Entre 2 e 3 salários mínimos,,,"Interessado, mas preocupado",Não ciclista,FALSE
2024-07-05T07:53:09.002Z,Daniel,Praça Polar,41-45,Masculino,Pardo (a),Vila Velha,,Trabalho fixo,,,,Utilizo pouco (+/-1 vez por mês),Mais de 2 vezes por semana,2 - Tenho medo,"Ciclovias e ciclofaixas mais seguras, Menos buracos nas ruas, Distância em relação aos carros, motos e outros meios",Não,"Faço exercícios enquanto ando de bicicleta., É bom pra minha saúde mental",Discordo,Concordo,Discordo,Concordo,Discordo,Concordo,Concordo,,,,,,,,,,,,,Motocicleta,Motocicleta,Não gostaria,,,,,5 - Muito confortável,3,3,1 - Muito desconfortável,4,1 - Muito desconfortável,5 - Muito confortável,5 - Muito confortável,1 - Muito desconfortável,3,5 - Muito confortável,4 - Concordo,Sim,Entre 1 e 2 salários mínimos,,SR 1,Entusiasmado e confiante,Ciclista,FALSE
2024-07-05T07:54:05.626Z,Alysson,Praça do polar,31-35,Masculino,Preto (a),Vila Velha,,Trabalho fixo,"Estudo/Faculdade/Educação, Academia",,,Utilizo sempre,5 ou mais vezes por semana,4 - Considero seguro,"Mais ciclovias e ciclofaixas, Ciclovias e ciclofaixas mais seguras, Qualidade das ciclovias e ciclofaixas, Menos buracos nas ruas, Menos obstáculos nas ciclovias e ciclofaixas (lixo, árvores, resíduos, etc.), Distância em relação aos carros, motos e outros meios, Local seguro para guardar a bicicleta, Segurança pública (em relação a assaltos)",Sim,"Gosto de andar de bicicleta (é prazeroso), Faço exercícios enquanto ando de bicicleta., É bom pra minha saúde mental, Trabalho",Concordo parcialmente,Concordo parcialmente,Concordo totalmente,Concordo totalmente,Concordo totalmente,Concordo,Concordo totalmente,,,,,,,,,,,,,Bicicleta,Ônibus Municipal ou Vans,Motocicleta,,,,,5 - Muito confortável,2,3,3,1 - Muito desconfortável,1 - Muito desconfortável,3,3,2,3,2,4 - Concordo,Sim,Entre 1 e 2 salários mínimos,,SR 1,"Interessado, mas preocupado",Ciclista,FALSE
2024-07-05T08:00:44.274Z,Alysson,Praça do polar,61-70,Feminino,Branco (a),Vila Velha,,Pensionista,Dança,,,Não utilizo,,,,,,,,,,,,,"Não tenho bicicleta, Tenho medo de sofrer um acidente andando de bicicleta, Não há ciclovias ou ciclofaixas no meu caminho, A qualidade das ciclovias e ciclofaixas no meu caminho é indequada",Discordo,Discordo,Discordo,Concordo parcialmente,Concordo,Discordo,Discordo,Discordo,Concordo parcialmente,Discordo,Concordo,Dirigindo carro,Não possui,Não gostaria,,,,,5 - Muito confortável,3,4,1 - Muito desconfortável,4,1 - Muito desconfortável,3,3,2,2,5 - Muito confortável,2 - Discordo,Não,Entre 2 e 3 salários mínimos,,SR 1,De jeito nenhum,Não ciclista,FALSE
2024-07-05T08:01:57.184Z,Daniel,Praça do polar,26-30,Feminino,Pardo (a),Jardim Iracema,,Trabalho intermitente,,,,Não utilizo,,,,,,,,,,,,,Não sei andar de bicicleta,Concordo,Concordo,Concordo,Concordo,Discordo,Discordo,Discordo totalmente,Concordo,Discordo,Concordo,Concordo,A pé,Uber carro,Não gostaria,,,,,5 - Muito confortável,3,3,1 - Muito desconfortável,2,1 - Muito desconfortável,3,5 - Muito confortável,1 - Muito desconfortável,3,5 - Muito confortável,4 - Concordo,Não,Entre 1 e 2 salários mínimos,,SR 1,"Interessado, mas preocupado",Não ciclista,FALSE
2024-07-05T08:15:19.829999Z,Alysson,Praça do polar,46-50,Masculino,Pardo (a),Barra Do Ceará,,Trabalho fixo,Academia,,,Utilizo sempre,Uma vez por semana,1 - Tenho muito medo,"Mais ciclovias e ciclofaixas, Ciclovias e ciclofaixas mais seguras, Qualidade das ciclovias e ciclofaixas, Menos buracos nas ruas, Menos obstáculos nas ciclovias e ciclofaixas (lixo, árvores, resíduos, etc.), Distância em relação aos carros, motos e outros meios, Os carros e outros meios de transporte trafegassem/andassem mais devagar, Local seguro para guardar a bicicleta, Segurança pública (em relação a assaltos)",Não,"Gosto de andar de bicicleta (é prazeroso), Faço exercícios enquanto ando de bicicleta., É bom pra minha saúde mental",Concordo,Concordo parcialmente,Concordo totalmente,Concordo totalmente,Concordo totalmente,Concordo totalmente,Concordo totalmente,,,,,,,,,,,,,Dirigindo carro,Motocicleta,Carro,,,,,5 - Muito confortável,2,3,2,4,2,2,3,2,4,5 - Muito confortável,5 - Concordo fortemente,Não,Entre 4 e 5 salários mínimos,,,"Interessado, mas preocupado",Ciclista,FALSE
2024-07-05T08:23:36.130Z,Daniel,Praça do polar,18 - 25,Masculino,Pardo (a),Quintino Cunha,,Trabalho fixo,"Estudo/Faculdade/Educação, Trabalho intermitente",,,Utilizo pouco (+/-1 vez por mês),Pelo menos 1 vez por mês,2 - Tenho medo,"Ciclovias e ciclofaixas mais seguras, Conforto térmico (temperatura na rua), Opções de hidratação, Qualidade das ciclovias e ciclofaixas, Menos buracos nas ruas, Menos obstáculos nas ciclovias e ciclofaixas (lixo, árvores, resíduos, etc.), Distância em relação aos carros, motos e outros meios, Os carros e outros meios de transporte trafegassem/andassem mais devagar, Local seguro para guardar a bicicleta, Segurança pública (em relação a assaltos)",Não,Faço exercícios enquanto ando de bicicleta.,Concordo,Discordo,Concordo,Concordo,Concordo,Concordo,Concordo,,,,,,,,,,,,,Ônibus Municipal ou Vans,Uber moto,Motocicleta,Não,Concordo,Sim,"Distância da viagem, Falta de estacionamento ou local para guardar a bicicleta",5 - Muito confortável,1 - Muito desconfortável,1 - Muito desconfortável,1 - Muito desconfortável,1 - Muito desconfortável,1 - Muito desconfortável,1 - Muito desconfortável,1 - Muito desconfortável,1 - Muito desconfortável,1 - Muito desconfortável,1 - Muito desconfortável,4 - Concordo,Sim,Entre 1 e 2 salários mínimos,,SR 3,"Interessado, mas preocupado",Ciclista,FALSE
2024-07-05T08:23:45.541999Z,Alysson,Praça do polar,61-70,Masculino,Branco (a),Barra Do Ceará,,Trabalho fixo,Caminhada,,,Não utilizo,,,,,,,,,,,,,"Não tenho bicicleta, Tenho medo de sofrer um acidente andando de bicicleta, Tenho medo de ser assaltado, Meu local de trabalho/estudo/lazer/ outros é muito distante para ir de bicicleta, Não há um lugar seguro para guardar a minha bicicleta, A qualidade das ciclovias e ciclofaixas no meu caminho é indequada, Desrespeito dos motoristas e motociclistas com o ciclista",Concordo,Concordo,Concordo totalmente,Discordo,Concordo,Discordo,Discordo totalmente,Concordo parcialmente,Concordo parcialmente,Concordo totalmente,Concordo,Ônibus Municipal ou Vans,Dirigindo carro,Não gostaria,Sim,Concordo,Não,"Distância da viagem, Falta de estacionamento ou local para guardar a bicicleta, Não tenho bicicleta, Tenho medo de sofrer um acidente andando de bicicleta, Tenho medo de ser assaltado andando de bicicleta",5 - Muito confortável,2,2,3,4,1 - Muito desconfortável,3,5 - Muito confortável,1 - Muito desconfortável,1 - Muito desconfortável,4,2 - Discordo,Não,Entre 1 e 2 salários mínimos,,,De jeito nenhum,Não ciclista,FALSE
2024-07-05T08:29:02.503Z,Danil,Praça polar,36-40,Masculino,Preto (a),Jardim Guanabara,,Aposentado (a),,,,Não utilizo,,,,,,,,,,,,,Não tenho bicicleta,Discordo,Concordo,Concordo,Discordo,Discordo,Concordo,Discordo totalmente,Concordo,Discordo totalmente,Concordo,Concordo,Uber moto,Ônibus Municipal ou Vans,Motocicleta,,,,,1 - Muito desconfortável,5 - Muito confortável,2,1 - Muito desconfortável,1 - Muito desconfortável,1 - Muito desconfortável,1 - Muito desconfortável,1 - Muito desconfortável,2,3,2,1 - Discordo fortemente,Não,Menor que 1 salário mínimo,,SR 1,De jeito nenhum,Não ciclista,FALSE
2024-07-05T08:36:20.642Z,Alysson,Praça do polar,31-35,Feminino,Pardo (a),Jardim Iracema,,Trabalho fixo,"Estudo/Faculdade/Educação, Esporte",,,Utilizo sempre,Mais de 2 vezes por semana,1 - Tenho muito medo,"Mais ciclovias e ciclofaixas, Ciclovias e ciclofaixas mais seguras, Qualidade das ciclovias e ciclofaixas, Menos buracos nas ruas, Menos obstáculos nas ciclovias e ciclofaixas (lixo, árvores, resíduos, etc.), Distância em relação aos carros, motos e outros meios, Local seguro para guardar a bicicleta, Segurança pública (em relação a assaltos)",Não,"Gosto de andar de bicicleta (é prazeroso), Faço exercícios enquanto ando de bicicleta., É bom pra minha saúde mental",Discordo totalmente,Discordo totalmente,Concordo totalmente,Concordo totalmente,Concordo parcialmente,Concordo totalmente,Concordo,,,,,,,,,,,,,Bicicleta,Dirigindo carro,Não gostaria,,,,,2,3,5 - Muito confortável,3,5 - Muito confortável,2,5 - Muito confortável,3,3,5 - Muito confortável,5 - Muito confortável,4 - Concordo,Sim,Entre 1 e 2 salários mínimos,,SR 1,Entusiasmado e confiante,Ciclista,TRUE
2024-07-05T08:47:01.321Z,Alysson,Praça do polar,Maior que 80,Masculino,Branco (a),Carlito Pamplona,,Aposentado (a),Caminhada,,,Não utilizo,,,,,,,,,,,,,"Não tenho bicicleta, Não sei andar de bicicleta, Tenho medo de sofrer um acidente andando de bicicleta, Tenho medo de ser assaltado, Não há ciclovias ou ciclofaixas no meu caminho, A qualidade das ciclovias e ciclofaixas no meu caminho é indequada",Concordo,Concordo parcialmente,Concordo totalmente,Concordo totalmente,Concordo totalmente,Concordo totalmente,Discordo totalmente,Discordo,Discordo,Concordo totalmente,Discordo totalmente,Dirigindo carro,Não possui,Não gostaria,,,,,5 - Muito confortável,3,4,2,4,2,4,4,1 - Muito desconfortável,4,4,1 - Discordo fortemente,Não,Entre 2 e 3 salários mínimos,,SR 1,Entusiasmado e confiante,Não ciclista,FALSE
2024-07-05T09:21:00.124Z,,,46-50,Masculino,Preto (a),Jardim Guanabara,,Trabalho fixo,Trabalho fixo,,,Não utilizo,,,,,,,,,,,,,"Não tenho bicicleta, Tenho medo de sofrer um acidente andando de bicicleta, Tenho medo de ser assaltado, Meu local de trabalho/estudo/lazer/ outros é muito distante para ir de bicicleta, A qualidade das ciclovias e ciclofaixas no meu caminho é indequada, Desrespeito dos motoristas e motociclistas com o ciclista",Concordo,Discordo,Discordo,Concordo totalmente,Concordo,Concordo totalmente,Discordo totalmente,Concordo parcialmente,Discordo,Concordo,Concordo totalmente,Motocicleta,Ônibus Municipal ou Vans,Carro,,,,,5 - Muito confortável,3,3,3,4,3,4,4,3,3,5 - Muito confortável,2 - Discordo,Não,Entre 1 e 2 salários mínimos,,SR 1,Entusiasmado e confiante,Não ciclista,FALSE
2024-07-05T09:23:36.292Z,Daniel,Praça polar,26-30,Masculino,Preto (a),Vila Velha,,Trabalho fixo,,,,Não utilizo,,,,,,,,,,,,,Não tenho bicicleta,Concordo,Concordo,Concordo,Concordo,Discordo,Concordo parcialmente,Discordo totalmente,Concordo parcialmente,Discordo totalmente,Concordo,Concordo,Motocicleta,Uber carro,Não gostaria,,,,,5 - Muito confortável,3,1 - Muito desconfortável,2,2,5 - Muito confortável,3,3,1 - Muito desconfortável,3,5 - Muito confortável,3 - Não sei dizer,Não,Entre 1 e 2 salários mínimos,,SR 1,De jeito nenhum,Não ciclista,TRUE
2024-07-05T09:29:32.607Z,Alysson,Praca do polar,61-70,Masculino,Branco (a),Vila Velha,,Aposentado (a),Não,,,Utilizo pouco (+/-1 vez por mês),Uma vez por semana,1 - Tenho muito medo,"Qualidade das ciclovias e ciclofaixas, Menos buracos nas ruas, Menos obstáculos nas ciclovias e ciclofaixas (lixo, árvores, resíduos, etc.), Local seguro para guardar a bicicleta",Sim,"Gosto de andar de bicicleta (é prazeroso), Faço exercícios enquanto ando de bicicleta., É bom pra minha saúde mental",Concordo,Concordo,Concordo totalmente,Concordo parcialmente,Discordo,Concordo,Concordo,,,,,,,,,,,,,Dirigindo carro,A pé,Não gostaria,,,,,5 - Muito confortável,4,5 - Muito confortável,2,4,2,4,4,1 - Muito desconfortável,3,4,4 - Concordo,Sim,Mais de 5 salários mínimos,,SR 1,Entusiasmado e confiante,Ciclista,FALSE
2024-07-05T09:36:45.561Z,Daniel,Praça polar,26-30,Feminino,Pardo (a),Vila Velha,,Trabalho intermitente,,,,Utilizo raramente,,,,,,,,,,,,,"Tenho medo de sofrer um acidente andando de bicicleta, Tenho medo de ser assaltado",Concordo,Concordo,Concordo,Concordo,Discordo,Concordo,Concordo parcialmente,Concordo,Concordo,Discordo totalmente,Concordo,Ônibus Municipal ou Vans,Uber carro,Carro,Não,Discordo,Não,Distância da viagem,5 - Muito confortável,3,3,1 - Muito desconfortável,3,2,3,5 - Muito confortável,1 - Muito desconfortável,1 - Muito desconfortável,5 - Muito confortável,4 - Concordo,Sim,Menor que 1 salário mínimo,,SR 1,"Interessado, mas preocupado",Não ciclista,FALSE
2024-07-05T09:37:08.015Z,Alysson,Praça do polar,61-70,Feminino,Branco (a),Vila Velha,,Dono (a) de casa,Reciclagem,,,Utilizo sempre,5 ou mais vezes por semana,"3 - Nem seguro, nem inseguro","Qualidade das ciclovias e ciclofaixas, Menos buracos nas ruas, Menos obstáculos nas ciclovias e ciclofaixas (lixo, árvores, resíduos, etc.), Segurança pública (em relação a assaltos)",Sim,"Não tenho outra opção, É mais barato, Gosto de andar de bicicleta (é prazeroso), Faço exercícios enquanto ando de bicicleta.",Concordo,Concordo parcialmente,Concordo totalmente,Concordo totalmente,Discordo,Discordo,Concordo totalmente,,,,,,,,,,,,,Bicicleta,Ônibus Municipal ou Vans,Carro,,,,,5 - Muito confortável,2,4,2,5 - Muito confortável,2,2,4,1 - Muito desconfortável,5 - Muito confortável,5 - Muito confortável,2 - Discordo,Sim,Menor que 1 salário mínimo,,SR 1,Entusiasmado e confiante,Ciclista,FALSE
2024-07-05T09:46:35.693Z,Alysson,Praça do polar,41-45,Masculino,Branco (a),Vila Velha,,Trabalho fixo,Academia,,,Utilizo pouco (+/-1 vez por mês),Mais de 2 vezes por semana,1 - Tenho muito medo,"Mais ciclovias e ciclofaixas, Ciclovias e ciclofaixas mais seguras, Qualidade das ciclovias e ciclofaixas, Menos buracos nas ruas, Distância em relação aos carros, motos e outros meios",Não,"Gosto de andar de bicicleta (é prazeroso), Faço exercícios enquanto ando de bicicleta., É bom pra minha saúde mental",Concordo,Concordo,Concordo,Discordo,Concordo totalmente,Concordo totalmente,Concordo totalmente,,,,,,,,,,,,,Motocicleta,Dirigindo carro,Não gostaria,,,,,5 - Muito confortável,3,4,1 - Muito desconfortável,4,1 - Muito desconfortável,4,4,1 - Muito desconfortável,4,4,4 - Concordo,Sim,Entre 2 e 3 salários mínimos,,SR 1,Entusiasmado e confiante,Ciclista,FALSE
2024-07-05T14:15:13.435Z,Daniel,Cuca barra,18 - 25,Masculino,Preto (a),Barra Do Ceará,,Trabalho fixo,Esporte,,,Utilizo sempre,5 ou mais vezes por semana,1 - Tenho muito medo,"Ciclovias e ciclofaixas mais seguras, Opções de hidratação, Menos buracos nas ruas, Distância em relação aos carros, motos e outros meios, Os carros e outros meios de transporte trafegassem/andassem mais devagar, Segurança pública (em relação a assaltos)",Sim,"Não tenho outra opção, Faço exercícios enquanto ando de bicicleta., É bom pra minha saúde mental",Concordo,Concordo,Concordo,Discordo,Discordo,Discordo,Discordo,,,,,,,,,,,,,Bicicleta,Uber moto,Motocicleta,,,,,5 - Muito confortável,5 - Muito confortável,3,2,2,1 - Muito desconfortável,3,4,1 - Muito desconfortável,2,5 - Muito confortável,2 - Discordo,Sim,Entre 1 e 2 salários mínimos,,,"Interessado, mas preocupado",Ciclista,FALSE
2024-07-05T14:21:34.533999Z,Daniel,Cuca barra,18 - 25,Feminino,Pardo (a),Barra Do Ceará,,Estudo/Faculdade/Educação,,Não,Não tenho bicicleta,Não utilizo,,,,,,,,,,,,,Não tenho bicicleta,Discordo,Discordo,Discordo,Discordo,Concordo,Concordo,Discordo totalmente,Concordo,Concordo,Concordo,Concordo,Ônibus Municipal ou Vans,Uber carro,Carro,Não,Discordo,Sim,Não tenho bicicleta,5 - Muito confortável,5 - Muito confortável,3,1 - Muito desconfortável,3,1 - Muito desconfortável,1 - Muito desconfortável,4,1 - Muito desconfortável,1 - Muito desconfortável,1 - Muito desconfortável,4 - Concordo,Sim,Prefiro não responder,,,"Interessado, mas preocupado",Não ciclista,FALSE
2024-07-05T14:38:36.088Z,Alysson,Cuca barra,18 - 25,Feminino,Pardo (a),Barra Do Ceará,,Não ocupado (a),Estudo/Faculdade/Educação,,,Utilizo pouco (+/-1 vez por mês),Mais de 2 vezes por semana,1 - Tenho muito medo,"Mais ciclovias e ciclofaixas, Ciclovias e ciclofaixas mais seguras, Qualidade das ciclovias e ciclofaixas, Menos buracos nas ruas, Menos obstáculos nas ciclovias e ciclofaixas (lixo, árvores, resíduos, etc.), Local seguro para guardar a bicicleta, Segurança pública (em relação a assaltos)",Sim,"É mais rápido, Resolver alguma questão como compras",Discordo,Concordo,Discordo,Concordo totalmente,Concordo totalmente,Concordo totalmente,Concordo totalmente,,,,,,,,,,,,,Motocicleta,Ônibus Municipal ou Vans,Bicicleta elétrica,,,,,4,4,3,1 - Muito desconfortável,4,1 - Muito desconfortável,5 - Muito confortável,4,1 - Muito desconfortável,2,4,5 - Concordo fortemente,Sim,Entre 1 e 2 salários mínimos,,,Entusiasmado e confiante,Ciclista,FALSE
2024-07-05T14:59:17.964Z,Alysson,Cuca barra,26-30,Mulher trans,Branco (a),Jardim Guanabara,,Monitoria da rede cuca,"Esporte, Dança",,,Utilizo pouco (+/-1 vez por mês),Pelo menos 1 vez por mês,1 - Tenho muito medo,"Mais ciclovias e ciclofaixas, Ciclovias e ciclofaixas mais seguras, Qualidade das ciclovias e ciclofaixas, Menos buracos nas ruas, Distância em relação aos carros, motos e outros meios, Local seguro para guardar a bicicleta, Segurança pública (em relação a assaltos)",Não,"É mais rápido, Gosto de andar de bicicleta (é prazeroso), Faço exercícios enquanto ando de bicicleta., É bom pra minha saúde mental",Concordo parcialmente,Concordo,Concordo,Concordo,Discordo,Concordo,Discordo,,,,,,,,,,,,,Ônibus Municipal ou Vans,Uber moto,Carro,Sim,Discordo,Sim,"Distância da viagem, Falta de estacionamento ou local para guardar a bicicleta, Não tenho bicicleta, Tenho medo de sofrer um acidente andando de bicicleta, Tenho medo de ser assaltado andando de bicicleta",5 - Muito confortável,3,2,1 - Muito desconfortável,3,1 - Muito desconfortável,4,5 - Muito confortável,2,4,1 - Muito desconfortável,4 - Concordo,Não,Entre 1 e 2 salários mínimos,,SR 1,Entusiasmado e confiante,Ciclista,FALSE
2024-07-05T15:25:43.539999Z,Alysson,Cuca barra,18 - 25,Masculino,Pardo (a),Barra Do Ceará,,Estudo/Faculdade/Educação,Esporte,Não,"Não tenho bicicleta, É muito longe, Tenho medo de ser assaltado andando de bicicleta, Tenho medo de sofrer um acidente indo de bicicleta, Não há ciclovias ou ciclofaixas no meu caminho para escola/faculdade, As ciclovias e ciclofaixas no meu caminho não são adequadas",Não utilizo,,,,,,,,,,,,,"Não tenho bicicleta, Tenho medo de sofrer um acidente andando de bicicleta, Tenho medo de ser assaltado, Meu local de trabalho/estudo/lazer/ outros é muito distante para ir de bicicleta, Não há ciclovias ou ciclofaixas no meu caminho, A qualidade das ciclovias e ciclofaixas no meu caminho é indequada",Concordo,Discordo,Discordo,Discordo,Concordo totalmente,Concordo,Discordo totalmente,Discordo,Discordo,Concordo,Discordo,A pé,Ônibus Municipal ou Vans,Não gostaria,,,,,5 - Muito confortável,1 - Muito desconfortável,1 - Muito desconfortável,1 - Muito desconfortável,2,1 - Muito desconfortável,4,2,1 - Muito desconfortável,4,2,2 - Discordo,Não,Menor que 1 salário mínimo,,,De jeito nenhum,Não ciclista,FALSE
2024-07-05T15:31:36.932Z,Alysson,Cuca barra,< Menor de 18 anos,Masculino,Pardo (a),Barra Do Ceará,,Estudo/Faculdade/Educação,"Esporte, Futsal",Sim,"Não tenho bicicleta, Tenho medo de ser assaltado andando de bicicleta, Tenho medo de sofrer um acidente indo de bicicleta, As ciclovias e ciclofaixas no meu caminho não são adequadas",Não utilizo,,,,,,,,,,,,,"Não tenho bicicleta, Tenho medo de sofrer um acidente andando de bicicleta, Tenho medo de ser assaltado, Não há ciclovias ou ciclofaixas no meu caminho, A qualidade das ciclovias e ciclofaixas no meu caminho é indequada",Concordo,Discordo,Discordo,Discordo,Concordo totalmente,Concordo totalmente,Discordo totalmente,Concordo parcialmente,Concordo,Discordo,Concordo totalmente,A pé,Uber moto,Motocicleta,,,,,4,4,2,2,3,2,4,2,2,1 - Muito desconfortável,4,4 - Concordo,Não,Entre 2 e 3 salários mínimos,,,"Interessado, mas preocupado",Não ciclista,FALSE
2024-07-05T15:49:34.668Z,Daniel,Cuca barra,18 - 25,Masculino,Pardo (a),Barra Do Ceará,,Estudo/Faculdade/Educação,,Sim,Já uso bicicleta,Utilizo sempre,5 ou mais vezes por semana,1 - Tenho muito medo,"Ciclovias e ciclofaixas mais seguras, Opções de hidratação, Distância em relação aos carros, motos e outros meios",Sim,Faço exercícios enquanto ando de bicicleta.,Concordo,Concordo,Concordo,Concordo,Concordo,Concordo,Concordo,,,,,,,,,,,,,Bicicleta,Ônibus Municipal ou Vans,Motocicleta,,,,,5 - Muito confortável,3,4,1 - Muito desconfortável,3,3,3,4,1 - Muito desconfortável,1 - Muito desconfortável,5 - Muito confortável,4 - Concordo,Sim,Menor que 1 salário mínimo,,,"Interessado, mas preocupado",Ciclista,FALSE
2024-07-25T07:40:42.771Z,Sabrina Farias,Feira do Planalto Ayrton Senna,18 - 25,Masculino,Pardo (a),Prefeito José Walter,,Trabalho fixo,,,,Utilizo raramente,,,,,,,,,,,,,Não tenho bicicleta,Discordo,Concordo,Discordo,Discordo,Concordo parcialmente,Discordo totalmente,Discordo totalmente,Concordo,Concordo totalmente,Concordo,Concordo totalmente,Motocicleta,,Carro,,,,,5 - Muito confortável,4,5 - Muito confortável,2,3,1 - Muito desconfortável,5 - Muito confortável,3,1 - Muito desconfortável,3,5 - Muito confortável,2 - Discordo,Não,Menor que 1 salário mínimo,,,Entusiasmado e confiante,Não ciclista,FALSE
2024-07-25T07:50:49.903Z,Sabrina Farias,Feira do Planalto Ayrton Senna,18 - 25,Feminino,Branco (a),Planalto Ayrton Senna,,Trabalho fixo,,,,Utilizo pouco (+/-1 vez por mês),Mais de 2 vezes por semana,2 - Tenho medo,"Ciclovias e ciclofaixas mais seguras, Distância em relação aos carros, motos e outros meios, Local seguro para guardar a bicicleta, Segurança pública (em relação a assaltos)",Sim,"É mais rápido, Faço exercícios enquanto ando de bicicleta., É bom pra minha saúde mental",Discordo totalmente,Concordo parcialmente,Discordo totalmente,Discordo totalmente,Concordo parcialmente,Concordo,Concordo totalmente,,,,,,,,,,,,,Bicicleta,,Motocicleta,,,,,5 - Muito confortável,5 - Muito confortável,3,1 - Muito desconfortável,2,1 - Muito desconfortável,2,5 - Muito confortável,1 - Muito desconfortável,3,5 - Muito confortável,5 - Concordo fortemente,Sim,Entre 1 e 2 salários mínimos,,SR 8,"Interessado, mas preocupado",Ciclista,FALSE
2024-07-25T08:08:41.471Z,Daniel,Feira do Planalto,31-35,Masculino,Pardo (a),Planalto Ayrton Senna,,Trabalho intermitente,,,,Utilizo sempre,5 ou mais vezes por semana,"3 - Nem seguro, nem inseguro","Mais ciclovias e ciclofaixas, Opções de hidratação, Menos obstáculos nas ciclovias e ciclofaixas (lixo, árvores, resíduos, etc.), Local seguro para guardar a bicicleta",Sim,"É mais rápido, É mais barato, É bom pra minha saúde mental",Discordo,Discordo,Discordo,Concordo,Concordo,Concordo,Concordo,,,,,,,,,,,,,Bicicleta,A pé,Motocicleta,,,,,5 - Muito confortável,3,3,2,3,1 - Muito desconfortável,3,4,1 - Muito desconfortável,1 - Muito desconfortável,5 - Muito confortável,3 - Não sei dizer,Sim,Menor que 1 salário mínimo,,SR 8,"Interessado, mas preocupado",Ciclista,FALSE
2024-07-25T08:14:36.184Z,Daniel,Feira do Planalto,26-30,Masculino,Pardo (a),Planalto Ayrton Senna,,Trabalho fixo,,,,Não utilizo,,,,,,,,,,,,,Não tenho bicicleta,Discordo,Discordo,Discordo,Discordo,Concordo,Concordo,Discordo totalmente,Discordo,Discordo totalmente,Concordo parcialmente,Concordo,Motocicleta,Dirigindo carro,Carro,,,,,5 - Muito confortável,3,3,1 - Muito desconfortável,3,1 - Muito desconfortável,4,5 - Muito confortável,1 - Muito desconfortável,1 - Muito desconfortável,5 - Muito confortável,4 - Concordo,Não,Entre 1 e 2 salários mínimos,,SR 8,"Interessado, mas preocupado",Não ciclista,FALSE
2024-07-25T08:16:54.831Z,Sabrina Farias,Feira do Planalto Ayrton Senna,56-60,Masculino,Pardo (a),Planalto Ayrton Senna,,Trabalho fixo,,,,Utilizo sempre,5 ou mais vezes por semana,"3 - Nem seguro, nem inseguro","Ciclovias e ciclofaixas mais seguras, Distância em relação aos carros, motos e outros meios, Local seguro para guardar a bicicleta, Segurança pública (em relação a assaltos)",Sim,"Gosto de andar de bicicleta (é prazeroso), É bom pra minha saúde mental",Discordo totalmente,Concordo parcialmente,Concordo,Concordo parcialmente,Concordo totalmente,Concordo,Concordo totalmente,,,,,,,,,,,,,Bicicleta,,Motocicleta,,,,,5 - Muito confortável,3,4,3,4,2,4,5 - Muito confortável,1 - Muito desconfortável,2,5 - Muito confortável,5 - Concordo fortemente,Sim,Entre 1 e 2 salários mínimos,,SR 8,"Interessado, mas preocupado",Ciclista,FALSE
2024-07-25T08:22:39.011Z,Daniel,Feira do Planalto,26-30,Feminino,Branco (a),Planalto Ayrton Senna,,Trabalho fixo,,,,Não utilizo,,,,,,,,,,,,,Não tenho bicicleta,Discordo,Discordo,Discordo,Concordo,Concordo,Concordo,Discordo totalmente,Concordo parcialmente,Discordo totalmente,Concordo parcialmente,Concordo,A pé,Uber carro,Motocicleta,,,,,5 - Muito confortável,3,2,1 - Muito desconfortável,2,1 - Muito desconfortável,3,5 - Muito confortável,1 - Muito desconfortável,2,5 - Muito confortável,4 - Concordo,Não,Entre 1 e 2 salários mínimos,,SR 8,"Interessado, mas preocupado",Não ciclista,FALSE
