2024-08-05T11:11:01.308Z,Daniel,Terminal conjuto ceara,< Menor de 18 anos,Masculino,Preto (a),Conjunto Ceará I,,Trabalho fixo,,,,Não utilizo,,,,,,,,,,,,,"Não tenho bicicleta, É muito quente em Fortaleza para andar de bicicleta, Meu local de trabalho/estudo/lazer/ outros é muito distante para ir de bicicleta, Não há um lugar seguro para guardar a minha bicicleta",Discordo,Concordo parcialmente,Discordo,Concordo,Discordo,Concordo,Discordo totalmente,Discordo,Discordo,Concordo,Concordo,Ônibus Municipal ou Vans,Carona de carro,Motocicleta,Sim,Concordo,Não,Distância da viagem,5 - Muito confortável,4,3,1 - Muito desconfortável,4,1 - Muito desconfortável,3,3,2,4,4,4 - Concordo,Não,Menor que 1 salário mínimo,,,Entusiasmado e confiante,Não ciclista,FALSE
2024-08-05T11:17:36.525Z,Daniel,Terminal conjunto Ceará,18 - 25,Feminino,Pardo (a),Granja Portugal,,Estudo/Faculdade/Educação,,Sim,Não tenho bicicleta,Não utilizo,,,,,,,,,,,,,Não tenho bicicleta,Concordo,Discordo,Concordo parcialmente,Concordo,Concordo parcialmente,Discordo,Discordo,Concordo,Discordo,Concordo,Concordo,Ônibus Municipal ou Vans,Uber moto,Carro,Sim,Discordo,Sim,"Distância da viagem, Não tenho bicicleta, Tenho medo de sofrer um acidente andando de bicicleta",5 - Muito confortável,3,3,5 - Muito confortável,4,1 - Muito desconfortável,3,1 - Muito desconfortável,,,,,,Prefiro não responder,,SR 5,,Não ciclista,TRUE
2024-08-05T11:18:36.672Z,Sabrina Farias,Terminal Conjunto Ceara,41-45,Feminino,Pardo (a),Granja Lisboa,,Dono (a) de casa,,,,Não utilizo,,,,,,,,,,,,,Não tenho bicicleta,Discordo totalmente,Concordo totalmente,Concordo totalmente,Discordo totalmente,Concordo totalmente,Concordo totalmente,Concordo totalmente,Concordo totalmente,Discordo totalmente,Concordo totalmente,Concordo totalmente,Uber carro,,Não gostaria,,,,,5 - Muito confortável,3,5 - Muito confortável,1 - Muito desconfortável,3,1 - Muito desconfortável,4,5 - Muito confortável,1 - Muito desconfortável,3,5 - Muito confortável,4 - Concordo,Não,Entre 1 e 2 salários mínimos,,SR 5,"Interessado, mas preocupado",Não ciclista,FALSE
2024-08-05T11:23:55.171Z,Daniel,Terminal conjunto Ceará,71-80,Masculino,Pardo (a),Granja Lisboa,,Aposentado (a),,,,Não utilizo,,,,,,,,,,,,,Tenho medo de sofrer um acidente andando de bicicleta,Concordo,Concordo parcialmente,Concordo,Concordo parcialmente,Discordo,Concordo parcialmente,Concordo parcialmente,Concordo parcialmente,Discordo,Concordo totalmente,Concordo totalmente,,,,,,,,,,,,,,,,,,,,,Prefiro não responder,,SR 5,,Não ciclista,TRUE
2024-08-05T11:26:19.910Z,Sabrina Farias,Terminal Conjunto Ceara,26-30,Feminino,Pardo (a),Granja Portugal,,Trabalho fixo,Estudo/Faculdade/Educação,,,Utilizo raramente,,,,,,,,,,,,,"Tenho medo de sofrer um acidente andando de bicicleta, Tenho medo de ser assaltado",Concordo totalmente,Concordo totalmente,Concordo totalmente,Concordo parcialmente,Concordo totalmente,Concordo totalmente,Discordo totalmente,Concordo totalmente,Concordo parcialmente,Concordo totalmente,Concordo totalmente,Ônibus Municipal ou Vans,,Carro,Sim,Concordo,Não,"Não tenho bicicleta, Tenho medo de sofrer um acidente andando de bicicleta",5 - Muito confortável,4,5 - Muito confortável,1 - Muito desconfortável,2,1 - Muito desconfortável,2,3,1 - Muito desconfortável,2,2,5 - Concordo fortemente,Não,Entre 1 e 2 salários mínimos,,SR 5,"Interessado, mas preocupado",Não ciclista,FALSE
2024-08-05T11:32:45.602Z,Daniel,Terminal conjunto Ceará,< Menor de 18 anos,Masculino,Branco (a),Granja Lisboa,,Estudo/Faculdade/Educação,Trabalho fixo,Não,"É muito longe, Não gosto de andar de bicicleta",Utilizo raramente,,,,,,,,,,,,,"Tenho medo de sofrer um acidente andando de bicicleta, Tenho medo de ser assaltado, Não há um lugar seguro para guardar a minha bicicleta",Concordo,Concordo,Concordo,Concordo,Concordo,Concordo,Concordo,Concordo,Concordo,Concordo,Concordo,Motocicleta,Ônibus Municipal ou Vans,Carro,,,,,5 - Muito confortável,1 - Muito desconfortável,3,1 - Muito desconfortável,3,1 - Muito desconfortável,3,3,1 - Muito desconfortável,3,3,3 - Não sei dizer,Sim,Menor que 1 salário mínimo,,SR 5,"Interessado, mas preocupado",Não ciclista,FALSE
2024-08-05T11:35:20.120Z,Sabrina Farias,Terminal Conjunto Ceara,18 - 25,Feminino,Pardo (a),Granja Lisboa,,Trabalho fixo,Estudo/Faculdade/Educação,,,Utilizo raramente,,,,,,,,,,,,,Não tenho bicicleta,Concordo totalmente,Concordo totalmente,Concordo totalmente,Concordo parcialmente,Concordo totalmente,Concordo parcialmente,Discordo totalmente,Concordo totalmente,Discordo totalmente,Concordo totalmente,Concordo totalmente,Ônibus Municipal ou Vans,Carona de motocicleta,Carro,Sim,Discordo fortemente,Não sei,Não tenho bicicleta,4,3,5 - Muito confortável,2,4,1 - Muito desconfortável,4,4,1 - Muito desconfortável,3,5 - Muito confortável,5 - Concordo fortemente,Não,Entre 1 e 2 salários mínimos,,SR 5,Entusiasmado e confiante,Não ciclista,FALSE
2024-08-05T11:40:05.814Z,Sabrina Farias,Terminal Conjunto Ceara,18 - 25,Feminino,Branco (a),Granja Lisboa,,Estudo/Faculdade/Educação,,Sim,Não sei andar de bicicleta,Não utilizo,,,,,,,,,,,,,Não sei andar de bicicleta,Discordo totalmente,Discordo totalmente,Concordo totalmente,Concordo totalmente,Concordo parcialmente,Concordo totalmente,Concordo totalmente,Concordo totalmente,Discordo totalmente,Concordo totalmente,Discordo totalmente,Ônibus Municipal ou Vans,,Carro,Sim,Discordo fortemente,Sim,Não sei andar de bicicleta,5 - Muito confortável,4,5 - Muito confortável,1 - Muito desconfortável,3,1 - Muito desconfortável,2,5 - Muito confortável,1 - Muito desconfortável,2,4,5 - Concordo fortemente,Não,Entre 1 e 2 salários mínimos,,SR 5,"Interessado, mas preocupado",Não ciclista,FALSE
2024-08-05T11:43:55.602Z,Daniel,Terminal conjunto Ceará,26-30,Masculino,Pardo (a),Bom Jardim,,Trabalho fixo,,,,Não utilizo,,,,,,,,,,,,,"Não tenho bicicleta, Meu local de trabalho/estudo/lazer/ outros é muito distante para ir de bicicleta",Concordo,Concordo,Concordo parcialmente,Concordo,Concordo parcialmente,Discordo,Discordo,Discordo,Discordo,Concordo,Concordo,Ônibus Municipal ou Vans,Carona de motocicleta,Carro,Sim,Discordo,Não,Distância da viagem,5 - Muito confortável,4,2,1 - Muito desconfortável,3,1 - Muito desconfortável,4,5 - Muito confortável,1 - Muito desconfortável,3,5 - Muito confortável,2 - Discordo,Não,Entre 1 e 2 salários mínimos,,SR 5,De jeito nenhum,Não ciclista,FALSE
2024-08-05T11:50:10.403Z,Sabrina Farias,Terminal Conjunto Ceara,18 - 25,Masculino,Pardo (a),Granja Lisboa,,Trabalho fixo,,,,Utilizo sempre,5 ou mais vezes por semana,1 - Tenho muito medo,"Menos buracos nas ruas, Menos obstáculos nas ciclovias e ciclofaixas (lixo, árvores, resíduos, etc.), Distância em relação aos carros, motos e outros meios, Segurança pública (em relação a assaltos)",Não,"É mais rápido, É mais barato, Gosto de andar de bicicleta (é prazeroso)",Concordo totalmente,Concordo parcialmente,Concordo totalmente,Concordo totalmente,Concordo totalmente,Concordo totalmente,Concordo totalmente,,,,,,,,,,,,,Bicicleta,,Não gostaria,,,,,5 - Muito confortável,4,4,1 - Muito desconfortável,5 - Muito confortável,1 - Muito desconfortável,4,4,1 - Muito desconfortável,3,5 - Muito confortável,2 - Discordo,Sim,Entre 2 e 3 salários mínimos,,SR 5,Entusiasmado e confiante,Ciclista,FALSE
2024-08-05T12:02:16.168Z,Sabrina Farias,Terminal Conjunto Ceara,31-35,Masculino,Pardo (a),Genibaú,,Trabalho fixo,,,,Não utilizo,,,,,,,,,,,,,"Não tenho bicicleta, Tenho medo de sofrer um acidente andando de bicicleta",Discordo totalmente,Discordo totalmente,Discordo totalmente,Concordo parcialmente,Concordo parcialmente,Discordo totalmente,Discordo totalmente,Discordo totalmente,Concordo parcialmente,Concordo parcialmente,Concordo totalmente,Uber moto,,Motocicleta,,,,,5 - Muito confortável,4,5 - Muito confortável,2,4,1 - Muito desconfortável,3,4,1 - Muito desconfortável,2,4,5 - Concordo fortemente,Sim,Entre 1 e 2 salários mínimos,,SR 11,"Interessado, mas preocupado",Não ciclista,FALSE
2024-08-05T12:02:20.311Z,Daniel,Terminal conjunto Ceará,18 - 25,Masculino,Branco (a),Autran Nunes,,Trabalho fixo,,,,Não utilizo,,,,,,,,,,,,,Não tenho bicicleta,Discordo totalmente,Concordo,Discordo,Discordo,Concordo parcialmente,Concordo,Discordo totalmente,Discordo,Concordo,Concordo,Concordo parcialmente,A pé,Ônibus Municipal ou Vans,Motocicleta,,,,,5 - Muito confortável,5 - Muito confortável,5 - Muito confortável,1 - Muito desconfortável,5 - Muito confortável,1 - Muito desconfortável,5 - Muito confortável,5 - Muito confortável,1 - Muito desconfortável,4,5 - Muito confortável,5 - Concordo fortemente,Não,Menor que 1 salário mínimo,,SR 11,Entusiasmado e confiante,Não ciclista,FALSE
2024-08-05T12:02:48.868Z,Sabrina Farias,Terminal Conjunto Ceara,26-30,Feminino,Pardo (a),Canindezinho,,Trabalho fixo,Estudo/Faculdade/Educação,,,Não utilizo,,,,,,,,,,,,,Não sei andar de bicicleta,Concordo,Concordo totalmente,Concordo,Concordo totalmente,Concordo,Concordo parcialmente,Discordo totalmente,Discordo totalmente,Discordo totalmente,Concordo totalmente,Discordo totalmente,Ônibus Municipal ou Vans,,Não gostaria,Sim,Discordo fortemente,Não sei,Não sei andar de bicicleta,5 - Muito confortável,4,4,2,3,1 - Muito desconfortável,2,4,1 - Muito desconfortável,1 - Muito desconfortável,4,5 - Concordo fortemente,Não,Entre 1 e 2 salários mínimos,,SR 10,"Interessado, mas preocupado",Não ciclista,FALSE
2024-08-05T12:17:26.724Z,Daniel,Terminal conjunto Ceará,< Menor de 18 anos,Masculino,Branco (a),Conjunto Ceará I,Caucaia,Trabalho fixo,Esporte,,,Utilizo pouco (+/-1 vez por mês),5 ou mais vezes por semana,2 - Tenho medo,Conforto térmico (temperatura na rua),Sim,Qualidade do ônibus é muito ruim,Concordo,Concordo,Concordo,Concordo,Concordo,Concordo,Concordo,,,,,,,,,,,,,Bicicleta,Ônibus Municipal ou Vans,,,,,,5 - Muito confortável,4,3,1 - Muito desconfortável,1 - Muito desconfortável,1 - Muito desconfortável,2,1 - Muito desconfortável,1 - Muito desconfortável,2,5 - Muito confortável,5 - Concordo fortemente,Sim,Menor que 1 salário mínimo,,,"Interessado, mas preocupado",Ciclista,FALSE
2024-08-05T12:18:15.502Z,Sabrina Farias,Terminal Conjunto Ceara,< Menor de 18 anos,Masculino,Pardo (a),Granja Lisboa,,Estudo/Faculdade/Educação,,Sim,Não sei andar de bicicleta,Não utilizo,,,,,,,,,,,,,Não sei andar de bicicleta,Concordo totalmente,Concordo parcialmente,Concordo totalmente,Concordo totalmente,Concordo parcialmente,Concordo totalmente,Discordo totalmente,Concordo parcialmente,Discordo,Concordo totalmente,Discordo totalmente,Ônibus Municipal ou Vans,,Bicicleta,Sim,Concordo fortemente,Sim,Não sei andar de bicicleta,5 - Muito confortável,4,4,1 - Muito desconfortável,4,1 - Muito desconfortável,4,5 - Muito confortável,1 - Muito desconfortável,2,5 - Muito confortável,5 - Concordo fortemente,Não,Entre 1 e 2 salários mínimos,,SR 5,"Interessado, mas preocupado",Não ciclista,FALSE
2024-08-05T12:23:36.702Z,Sabrina Farias,Terminal Conjunto Ceara,41-45,Feminino,Preto (a),Bom Jardim,,Trabalho fixo,,,,Não utilizo,,,,,,,,,,,,,"Tenho medo de sofrer um acidente andando de bicicleta, Tenho medo de ser assaltado",Discordo totalmente,Concordo totalmente,Concordo totalmente,Discordo totalmente,Concordo parcialmente,Discordo totalmente,Discordo totalmente,Concordo totalmente,Discordo totalmente,Concordo totalmente,Concordo totalmente,Ônibus Municipal ou Vans,,Carro,Sim,Discordo fortemente,Não,"Tenho medo de sofrer um acidente andando de bicicleta, Tenho medo de ser assaltado andando de bicicleta",5 - Muito confortável,2,4,1 - Muito desconfortável,3,1 - Muito desconfortável,3,4,1 - Muito desconfortável,2,5 - Muito confortável,5 - Concordo fortemente,Não,Entre 1 e 2 salários mínimos,,SR 5,"Interessado, mas preocupado",Não ciclista,FALSE
2024-08-05T12:26:35.000999Z,Daniel,Terminal conjunto Ceará,< Menor de 18 anos,Feminino,Branco (a),Conjunto Ceará I,,Estudo/Faculdade/Educação,,Sim,"Tenho medo de ser assaltado andando de bicicleta, Meu caminho para escola/faculdade é muito quente",Utilizo pouco (+/-1 vez por mês),Raramente,2 - Tenho medo,"Mais ciclovias e ciclofaixas, Conforto térmico (temperatura na rua), Segurança pública (em relação a assaltos)",Sim,"É mais rápido, É mais barato",Discordo,Concordo,Concordo,Discordo,Concordo,Concordo,Concordo,,,,,,,,,,,,,Ônibus Municipal ou Vans,Uber carro,Carro,Sim,Concordo,Não,"Distância da viagem, Falta de estacionamento ou local para guardar a bicicleta, Má qualidade do estacionamento / dificuldade de usar.",5 - Muito confortável,3,3,1 - Muito desconfortável,3,2,3,2,1 - Muito desconfortável,2,3,4 - Concordo,Sim,Prefiro não responder,,,"Interessado, mas preocupado",Ciclista,FALSE
2024-08-05T12:36:28.882Z,Daniel,Terminal conjunto Ceará,< Menor de 18 anos,Masculino,Branco (a),Granja Portugal,,Trabalho fixo,,,,Utilizo raramente,,,,,,,,,,,,,"A qualidade das ciclovias e ciclofaixas no meu caminho é indequada, Desrespeito dos motoristas e motociclistas com o ciclista",Concordo,Discordo,Concordo,Concordo,Concordo,Concordo,Concordo,Concordo,Concordo,Concordo,Concordo,Ônibus Municipal ou Vans,Bicicleta,Carro,Sim,Concordo,Não,"Falta de estacionamento ou local para guardar a bicicleta, Má qualidade do estacionamento / dificuldade de usar., Tenho medo de ser assaltado andando de bicicleta",5 - Muito confortável,3,4,1 - Muito desconfortável,2,1 - Muito desconfortável,4,5 - Muito confortável,1 - Muito desconfortável,4,5 - Muito confortável,4 - Concordo,Sim,Menor que 1 salário mínimo,,SR 5,"Interessado, mas preocupado",Não ciclista,FALSE
2024-08-05T12:38:52.267Z,Dniel,Terminal conjunto Ceará,18 - 25,Masculino,Pardo (a),Mondubim,,Trabalho fixo,,,,Utilizo sempre,5 ou mais vezes por semana,"3 - Nem seguro, nem inseguro","Ciclovias e ciclofaixas mais seguras, Opções de hidratação, Menos obstáculos nas ciclovias e ciclofaixas (lixo, árvores, resíduos, etc.), Local seguro para guardar a bicicleta, Segurança pública (em relação a assaltos)",Não,"É mais rápido, Gosto de andar de bicicleta (é prazeroso), Faço exercícios enquanto ando de bicicleta.",Concordo,Concordo,Concordo,Concordo,Concordo,Concordo,Concordo,,,,,,,,,,,,,Bicicleta,Ônibus intermunicipal,Motocicleta,,,,,5 - Muito confortável,2,1 - Muito desconfortável,1 - Muito desconfortável,3,1 - Muito desconfortável,3,4,1 - Muito desconfortável,2,5 - Muito confortável,3 - Não sei dizer,Sim,Entre 1 e 2 salários mínimos,,SR 10,"Interessado, mas preocupado",Ciclista,FALSE
2024-08-05T12:46:12.136Z,Daniel,Terminal conjunto Ceará,31-35,Feminino,Preto (a),Bom Jardim,,Trabalho fixo,Estudo/Faculdade/Educação,,,Utilizo sempre,5 ou mais vezes por semana,2 - Tenho medo,"Mais ciclovias e ciclofaixas, Qualidade das ciclovias e ciclofaixas, Menos buracos nas ruas, Menos obstáculos nas ciclovias e ciclofaixas (lixo, árvores, resíduos, etc.), Local seguro para guardar a bicicleta, Segurança pública (em relação a assaltos)",Não,"Gosto de andar de bicicleta (é prazeroso), Faço exercícios enquanto ando de bicicleta., É bom pra minha saúde mental",Discordo,Concordo,Concordo,Concordo,Concordo,Discordo,Concordo,,,,,,,,,,,,,Bicicleta,Ônibus Municipal ou Vans,Carro,,,,,4,2,2,1 - Muito desconfortável,3,1 - Muito desconfortável,2,2,1 - Muito desconfortável,1 - Muito desconfortável,3,4 - Concordo,Sim,Prefiro não responder,,SR 5,"Interessado, mas preocupado",Ciclista,FALSE
2024-08-05T12:48:09.200Z,Sabrina Farias,Terminal Conjunto Ceara,56-60,Feminino,Pardo (a),Granja Lisboa,,Dono (a) de casa,,,,Não utilizo,,,,,,,,,,,,,Tenho medo de sofrer um acidente andando de bicicleta,Concordo totalmente,Concordo totalmente,Concordo totalmente,Discordo totalmente,Concordo totalmente,Discordo totalmente,Discordo totalmente,Discordo totalmente,Discordo totalmente,Concordo totalmente,Concordo totalmente,Ônibus Municipal ou Vans,,Não gostaria,Não se aplica,Não se aplica,Não sei,Tenho medo de sofrer um acidente andando de bicicleta,4,1 - Muito desconfortável,4,1 - Muito desconfortável,2,1 - Muito desconfortável,2,4,1 - Muito desconfortável,1 - Muito desconfortável,3,1 - Discordo fortemente,Não,Entre 1 e 2 salários mínimos,,SR 5,De jeito nenhum,Não ciclista,FALSE
2024-08-05T12:49:00.775001Z,Daniel,Terminal conjunto Ceará,18 - 25,Feminino,Preto (a),Bom Jardim,,Trabalho fixo,,,,Não utilizo,,,,,,,,,,,,,Não tenho bicicleta,Concordo,Concordo,Concordo,Concordo,Discordo,Discordo,Discordo,Discordo,Discordo,Concordo,Concordo,Motocicleta,Ônibus Municipal ou Vans,Carro,,,,,5 - Muito confortável,3,2,1 - Muito desconfortável,3,1 - Muito desconfortável,,,,,,,,Prefiro não responder,,SR 5,,Não ciclista,TRUE
2024-08-05T12:54:35.488Z,Sabrina Farias,Terminal Conjunto Ceara,18 - 25,Feminino,Branco (a),Conjunto Ceará I,,Estudo/Faculdade/Educação,,Sim,"É muito longe, Tenho medo de sofrer um acidente indo de bicicleta",Não utilizo,,,,,,,,,,,,,Tenho medo de sofrer um acidente andando de bicicleta,Concordo totalmente,Concordo totalmente,Discordo totalmente,Concordo totalmente,Concordo parcialmente,Concordo parcialmente,Concordo totalmente,Discordo totalmente,Discordo totalmente,Concordo totalmente,Concordo totalmente,Ônibus Municipal ou Vans,,Motocicleta,Sim,Discordo fortemente,Sim,Tenho medo de sofrer um acidente andando de bicicleta,5 - Muito confortável,4,5 - Muito confortável,1 - Muito desconfortável,2,1 - Muito desconfortável,2,5 - Muito confortável,1 - Muito desconfortável,1 - Muito desconfortável,4,5 - Concordo fortemente,Não,Entre 1 e 2 salários mínimos,,,"Interessado, mas preocupado",Não ciclista,FALSE
2024-08-05T12:56:25.034Z,Daniel,Terminal conjunto 3,< Menor de 18 anos,Masculino,Preto (a),Granja Portugal,,Estudo/Faculdade/Educação,,Sim,Não tenho bicicleta,Utilizo pouco (+/-1 vez por mês),Pelo menos 1 vez por mês,1 - Tenho muito medo,"Ciclovias e ciclofaixas mais seguras, Qualidade das ciclovias e ciclofaixas, Menos buracos nas ruas, Menos obstáculos nas ciclovias e ciclofaixas (lixo, árvores, resíduos, etc.), Distância em relação aos carros, motos e outros meios",Não,"É mais barato, Gosto de andar de bicicleta (é prazeroso), Faço exercícios enquanto ando de bicicleta.",Concordo,Concordo,Concordo parcialmente,Discordo,Concordo parcialmente,Concordo,Concordo,,,,,,,,,,,,,A pé,Ônibus Municipal ou Vans,Uber carro,,,,,5 - Muito confortável,3,4,1 - Muito desconfortável,4,1 - Muito desconfortável,5 - Muito confortável,3,1 - Muito desconfortável,3,5 - Muito confortável,5 - Concordo fortemente,Sim,Prefiro não responder,,SR 5,Entusiasmado e confiante,Ciclista,FALSE
2024-08-05T13:00:34.612Z,Sabrina Farias,Terminal Conjunto Ceara,< Menor de 18 anos,Feminino,Pardo (a),Vila Velha,,Estudo/Faculdade/Educação,,Sim,Já uso bicicleta,Utilizo pouco (+/-1 vez por mês),Mais de 2 vezes por semana,1 - Tenho muito medo,"Ciclovias e ciclofaixas mais seguras, Menos buracos nas ruas, Segurança pública (em relação a assaltos)",Não,Gosto de andar de bicicleta (é prazeroso),Discordo totalmente,Discordo totalmente,Concordo totalmente,Concordo totalmente,Concordo totalmente,Concordo parcialmente,Concordo totalmente,,,,,,,,,,,,,Ônibus Municipal ou Vans,,Carro,Sim,Discordo fortemente,Sim,Distância da viagem,5 - Muito confortável,3,4,3,4,1 - Muito desconfortável,4,4,1 - Muito desconfortável,1 - Muito desconfortável,4,5 - Concordo fortemente,Sim,Entre 1 e 2 salários mínimos,,SR 1,"Interessado, mas preocupado",Ciclista,FALSE
2024-08-05T13:06:37.613Z,Sabrina Farias,Terminal Conjunto Ceara,< Menor de 18 anos,Feminino,Pardo (a),Bom Jardim,,Estudo/Faculdade/Educação,,Sim,É muito longe,Utilizo sempre,Mais de 2 vezes por semana,2 - Tenho medo,"Ciclovias e ciclofaixas mais seguras, Menos buracos nas ruas, Segurança pública (em relação a assaltos)",Não,"É mais rápido, É mais barato, Gosto de andar de bicicleta (é prazeroso)",Discordo totalmente,Concordo totalmente,Discordo totalmente,Discordo totalmente,Concordo parcialmente,Concordo totalmente,Concordo totalmente,,,,,,,,,,,,,Ônibus Municipal ou Vans,,Uber moto,Sim,Discordo fortemente,Sim,Distância da viagem,5 - Muito confortável,4,5 - Muito confortável,3,3,2,3,4,1 - Muito desconfortável,1 - Muito desconfortável,5 - Muito confortável,5 - Concordo fortemente,Não,Entre 1 e 2 salários mínimos,,SR 5,"Interessado, mas preocupado",Ciclista,FALSE
2024-08-05T13:29:48.617Z,Sabrina Farias,Terminal Conjunto Ceara,31-35,Feminino,Pardo (a),Genibaú,,Trabalho fixo,,,,Não utilizo,,,,,,,,,,,,,"Não tenho bicicleta, Tenho medo de sofrer um acidente andando de bicicleta",Concordo parcialmente,Concordo totalmente,Concordo totalmente,Concordo totalmente,Concordo totalmente,Concordo parcialmente,Discordo totalmente,Discordo totalmente,Discordo totalmente,Concordo totalmente,Concordo totalmente,Ônibus Municipal ou Vans,,Carro,Sim,Discordo fortemente,Não sei,"Não tenho bicicleta, Tenho medo de sofrer um acidente andando de bicicleta",4,3,4,1 - Muito desconfortável,2,1 - Muito desconfortável,1 - Muito desconfortável,3,1 - Muito desconfortável,1 - Muito desconfortável,4,2 - Discordo,Não,Entre 1 e 2 salários mínimos,,SR 11,De jeito nenhum,Não ciclista,FALSE
2024-08-05T13:32:32.553Z,Daniel,Terminal conjunto Ceará,18 - 25,Masculino,Pardo (a),Bom Jardim,,Trabalho fixo,,,,Utilizo sempre,5 ou mais vezes por semana,"3 - Nem seguro, nem inseguro",Mais ciclovias e ciclofaixas,Não,"É mais rápido, É mais barato",Concordo,Concordo,Concordo,Concordo,Concordo,Concordo,Concordo,,,,,,,,,,,,,A pé,Ônibus Municipal ou Vans,Carro,,,,,5 - Muito confortável,1 - Muito desconfortável,2,1 - Muito desconfortável,2,1 - Muito desconfortável,4,3,1 - Muito desconfortável,1 - Muito desconfortável,5 - Muito confortável,4 - Concordo,Não,Entre 1 e 2 salários mínimos,,SR 5,"Interessado, mas preocupado",Ciclista,FALSE
2024-08-05T13:40:15.447999Z,Sabrina Farias,Terminal Conjunto Ceara,< Menor de 18 anos,Feminino,Preto (a),Granja Portugal,,Estudo/Faculdade/Educação,,Sim,Não gosto de andar de bicicleta,Utilizo pouco (+/-1 vez por mês),Mais de 2 vezes por semana,1 - Tenho muito medo,"Ciclovias e ciclofaixas mais seguras, Menos buracos nas ruas",Sim,Faço exercícios enquanto ando de bicicleta.,Discordo totalmente,Discordo totalmente,Concordo totalmente,Concordo totalmente,Concordo parcialmente,Concordo totalmente,Concordo totalmente,,,,,,,,,,,,,Ônibus Municipal ou Vans,,Não gostaria,Não,Concordo fortemente,Sim,Não gosto de bicicleta,5 - Muito confortável,3,4,1 - Muito desconfortável,3,1 - Muito desconfortável,2,5 - Muito confortável,1 - Muito desconfortável,1 - Muito desconfortável,5 - Muito confortável,5 - Concordo fortemente,Sim,Entre 1 e 2 salários mínimos,,SR 5,"Interessado, mas preocupado",Ciclista,FALSE
2024-08-05T13:40:56.813Z,Daniel,Terminal conjunto Ceará,26-30,Masculino,Pardo (a),Granja Lisboa,,Trabalho fixo,,,,Não utilizo,,,,,,,,,,,,,Não tenho bicicleta,Concordo,Concordo,Concordo parcialmente,Concordo,Discordo,Concordo,Discordo totalmente,Discordo totalmente,Discordo totalmente,Discordo,Concordo,Motocicleta,Ônibus Municipal ou Vans,Carro,,,,,5 - Muito confortável,5 - Muito confortável,,,,,,,,,,,,Prefiro não responder,,SR 5,,Não ciclista,TRUE
2024-08-05T13:46:33.918Z,Sabrina Farias,Terminal Conjunto Ceara,18 - 25,Masculino,Preto (a),Bom Jardim,,Trabalho fixo,,,,Utilizo sempre,Mais de 2 vezes por semana,4 - Considero seguro,"Ciclovias e ciclofaixas mais seguras, Menos buracos nas ruas, Local seguro para guardar a bicicleta",Não,"É mais rápido, É mais barato, Gosto de andar de bicicleta (é prazeroso)",Concordo totalmente,Concordo totalmente,Concordo,Concordo parcialmente,Concordo totalmente,Concordo parcialmente,Concordo totalmente,,,,,,,,,,,,,Ônibus Municipal ou Vans,Bicicleta,Não gostaria,Sim,Concordo,Sim,,4,3,4,3,4,3,4,4,1 - Muito desconfortável,3,4,2 - Discordo,Sim,Entre 1 e 2 salários mínimos,,SR 5,Entusiasmado e confiante,Ciclista,FALSE
2024-08-05T13:50:24.847Z,Daniel,Terminal conjunto Ceará,46-50,Masculino,Pardo (a),Bom Jardim,,Trabalho fixo,,,,Utilizo sempre,Mais de 2 vezes por semana,4 - Considero seguro,"Mais ciclovias e ciclofaixas, Ciclovias e ciclofaixas mais seguras",Não,"É mais rápido, É mais barato, Faço exercícios enquanto ando de bicicleta., É bom pra minha saúde mental",Discordo,Concordo,Concordo,Concordo,Concordo,Concordo,Concordo,,,,,,,,,,,,,A pé,Bicicleta,Não gostaria,,,,,4,3,3,2,4,4,4,5 - Muito confortável,3,4,4,4 - Concordo,Sim,Prefiro não responder,,SR 5,Entusiasmado e confiante,Ciclista,TRUE
2024-08-05T16:40:27.388Z,Daniel,Praça da juventude,61-70,Masculino,Pardo (a),Granja Portugal,,Trabalho intermitente,,,,Utilizo sempre,5 ou mais vezes por semana,2 - Tenho medo,"Mais ciclovias e ciclofaixas, Ciclovias e ciclofaixas mais seguras, Menos buracos nas ruas, Menos obstáculos nas ciclovias e ciclofaixas (lixo, árvores, resíduos, etc.), Distância em relação aos carros, motos e outros meios, Segurança pública (em relação a assaltos)",Sim,"É mais rápido, Gosto de andar de bicicleta (é prazeroso), Faço exercícios enquanto ando de bicicleta., É bom pra minha saúde mental",Concordo parcialmente,Concordo,Concordo,Discordo,Concordo parcialmente,Concordo,Concordo,,,,,,,,,,,,,Bicicleta,Ônibus Municipal ou Vans,Carro,,,,,5 - Muito confortável,1 - Muito desconfortável,4,2,3,1 - Muito desconfortável,4,4,1 - Muito desconfortável,4,4,4 - Concordo,Sim,Menor que 1 salário mínimo,,SR 5,Entusiasmado e confiante,Ciclista,FALSE
